{"schemaVersion":"1.0.0","protocolVersion":"0.10.0","status":"pass","outcome":"success","exit":0,"subject":"review","data":{"batchId":"BR-941-live","fingerprint":"ffad64ff3208f284a4316456a71d7a5099abf31dcf2c584e29284153fac47321","sources":[{"path":"specs/features/farewell/spec.md","sha256":"219d6a7bbf2804bd696459a1d694c83b3e96b64ddfae1fb7def8cf552ba87f29"},{"path":"specs/features/greeting/spec.md","sha256":"fbcccc1e28d25c3b9bf4b910638fd37a866b38ab92d36441d87ac41bb7bd9368"},{"path":"specs/stories/FX-001-greet-function/acceptance.md","sha256":"df9246fa0f51fd03df2555bc67268219f7feaa8303aeca2e323f967278c4c78c"},{"path":"specs/stories/FX-001-greet-function/readiness.json","sha256":"ca6a58fb956fde2d4ec28c28aef31a30f6789fa61db62639e0cd21b659e28e25"},{"path":"specs/stories/FX-001-greet-function/story.md","sha256":"b3c79bf029fde2ae865aac8ec996315c7f034c8c789a788e157b41d40abed56f"},{"path":"specs/stories/FX-002-greet-test/acceptance.md","sha256":"a3901fd8ff307c3d9286e103e3f161d20df22a0a557fd56a4f6d278833893fb6"},{"path":"specs/stories/FX-002-greet-test/readiness.json","sha256":"fd4d27b8bba9b4378c23dfe1d7b484c03f489c0a3db8d836802c12905b5307ff"},{"path":"specs/stories/FX-002-greet-test/story.md","sha256":"11757aaebde7cd1af21236434b39001790b564e8e4de8b7cf0a3121c2c519362"},{"path":"specs/stories/FX-003-farewell-function/acceptance.md","sha256":"6993b7c0e78f764343f355c404a40f4f4e76a8296757ae11416725f115007889"},{"path":"specs/stories/FX-003-farewell-function/readiness.json","sha256":"59ea46783c639f070c4a06f06135035ccced6fa05f1cbf70ab0e53db53f0f27d"},{"path":"specs/stories/FX-003-farewell-function/story.md","sha256":"ea39683331da00200e06429088da5ca2f482977fadfad85abe5c187f25277314"},{"path":"specs/stories/FX-004-usage-readme/acceptance.md","sha256":"305ce1e50d2ab60a8bcedfac23ab4ab03b6a0454a14983bea4913c3155d0f011"},{"path":"specs/stories/FX-004-usage-readme/readiness.json","sha256":"ad94059cc89ea2a953a04563ba0d3595fd832264dd33fbea592aed3a89eece4e"},{"path":"specs/stories/FX-004-usage-readme/story.md","sha256":"9b21c131ae60baf96a079d09903efb4af1e3146c2938b2e4998eff24cd30052a"}],"diagnostics":[{"code":"REVIEW_SECTION_UNRECOGNIZED","severity":"advisory","locator":{"path":"specs/features/greeting/spec.md","anchor":"Spec：Greeting","blockSha256":"fbcccc1e28d25c3b9bf4b910638fd37a866b38ab92d36441d87ac41bb7bd9368"}},{"code":"REVIEW_SECTION_UNRECOGNIZED","severity":"advisory","locator":{"path":"specs/features/farewell/spec.md","anchor":"Spec：Farewell","blockSha256":"219d6a7bbf2804bd696459a1d694c83b3e96b64ddfae1fb7def8cf552ba87f29"}}],"output":"specs/batches/BR-941-live/review.html"},"issues":[{"code":"REVIEW_SECTION_UNRECOGNIZED","message":"unrecognized section: Spec：Greeting","path":"specs/features/greeting/spec.md"},{"code":"REVIEW_SECTION_UNRECOGNIZED","message":"unrecognized section: Spec：Farewell","path":"specs/features/farewell/spec.md"}]}
